{
  "artifact_type": "hyperray_semantic_coverage",
  "schema_version": 2,
  "artifact_id": "coverage.symbolic.fixture",
  "coverage_id": "coverage.symbolic",
  "boundary_artifact": { "artifact_id": "boundary", "artifact_type": "hyperray_boundary", "schema_version": 1, "sha256": "0000000000000000000000000000000000000000000000000000000000000000" },
  "model_artifact": { "artifact_id": "model", "artifact_type": "hyperray_model", "schema_version": 2, "sha256": "0000000000000000000000000000000000000000000000000000000000000000" },
  "artifact_digests": {
    "boundary": { "artifact_id": "boundary", "artifact_type": "hyperray_boundary", "schema_version": 1, "sha256": "0000000000000000000000000000000000000000000000000000000000000000" },
    "model": { "artifact_id": "model", "artifact_type": "hyperray_model", "schema_version": 2, "sha256": "0000000000000000000000000000000000000000000000000000000000000000" },
    "compiler_inventory": { "artifact_id": "inventory", "artifact_type": "compiler_inventory", "schema_version": 1, "sha256": "0000000000000000000000000000000000000000000000000000000000000000" },
    "compiler_output": { "artifact_id": "compiler.output", "artifact_type": "compiler_output", "schema_version": 1, "sha256": "0000000000000000000000000000000000000000000000000000000000000000" },
    "executable_image": { "artifact_id": "image", "artifact_type": "executable_image", "schema_version": 1, "sha256": "0000000000000000000000000000000000000000000000000000000000000000" },
    "target_semantics": { "artifact_id": "semantics.target", "artifact_type": "semantic_spec", "schema_version": 1, "sha256": "0000000000000000000000000000000000000000000000000000000000000000" },
    "environment_semantics": { "artifact_id": "semantics.environment", "artifact_type": "semantic_spec", "schema_version": 1, "sha256": "0000000000000000000000000000000000000000000000000000000000000000" },
    "root_catalog": { "artifact_id": "roots", "artifact_type": "root_catalog", "schema_version": 1, "sha256": "0000000000000000000000000000000000000000000000000000000000000000" },
    "requirements": [{ "artifact_id": "requirement", "artifact_type": "hyperray_requirement", "schema_version": 2, "sha256": "0000000000000000000000000000000000000000000000000000000000000000" }]
  },
  "exact_counts": {
    "compiler_inventory_operations": "2",
    "mapped_operations": "1",
    "eliminated_operations": "1",
    "compiler_output_records": "1",
    "image_instructions": "1",
    "semantic_cases": "1",
    "model_effects": "1",
    "circuit_nodes": "12",
    "circuit_ports": "19",
    "environment_actions": "0",
    "roots": "1",
    "query_root_selections": "1",
    "query_reachability_annotations": "1",
    "concrete_enabled_step_assignments": {
      "count": "2",
      "validated_certificate": { "artifact_id": "certificate.count", "artifact_type": "hyperray_validated_certificate", "schema_version": 2, "certificate_kind": "symbolic_exact_count", "sha256": "0000000000000000000000000000000000000000000000000000000000000000" }
    }
  },
  "compiler_inventory": [
    {
      "operation_id": "operation.add",
      "kind": "source",
      "concrete_instance_id": "instance.add",
      "provenance": {
        "producer": { "name": "inventory-tool", "version": "1", "executable_sha256": "0000000000000000000000000000000000000000000000000000000000000000", "arguments": [] },
        "source_artifact": { "artifact_id": "source", "artifact_type": "source_code", "schema_version": 1, "sha256": "0000000000000000000000000000000000000000000000000000000000000000" },
        "source_locator": "main.c:1"
      }
    },
    {
      "operation_id": "operation.folded",
      "kind": "source",
      "concrete_instance_id": "instance.folded",
      "provenance": {
        "producer": { "name": "inventory-tool", "version": "1", "executable_sha256": "0000000000000000000000000000000000000000000000000000000000000000", "arguments": [] },
        "source_artifact": { "artifact_id": "source", "artifact_type": "source_code", "schema_version": 1, "sha256": "0000000000000000000000000000000000000000000000000000000000000000" },
        "source_locator": "main.c:2"
      }
    }
  ],
  "forward_reconciliation": {
    "operation_dispositions": [
      {
        "disposition": "mapped",
        "operation_id": "operation.add",
        "mapping": {
          "compiler_output_ids": ["output.0"],
          "image_instruction_ids": ["instruction.0"],
          "semantic_case_ids": ["case.add"],
          "model_effects": [{ "kind": "machine_step_effect", "effect_id": "effect.add", "guard_port_id": "p.effect.add", "enabled_port_id": "p.enabled", "next_state_port_id": "p.next", "image_instruction_ids": ["instruction.0"], "semantic_case_ids": ["case.add"], "observation_port_ids": ["p.obs"], "proof_obligation_id": "obligation.effect.add" }],
          "provenance_edge_ids": ["edge.operation.output"]
        }
      },
      {
        "disposition": "eliminated_with_proof",
        "operation_id": "operation.folded",
        "elimination_record_id": "elimination.folded",
        "elimination_proof": { "artifact_id": "proof.elimination", "artifact_type": "proof_evidence", "schema_version": 1, "sha256": "0000000000000000000000000000000000000000000000000000000000000000" },
        "equivalent_model_effects": [{ "kind": "machine_step_effect", "effect_id": "effect.add", "guard_port_id": "p.effect.add", "enabled_port_id": "p.enabled", "next_state_port_id": "p.next", "image_instruction_ids": ["instruction.0"], "semantic_case_ids": ["case.add"], "observation_port_ids": ["p.obs"], "proof_obligation_id": "obligation.effect.add" }],
        "provenance_edge_ids": ["edge.operation.output"]
      }
    ],
    "environment_paths": [],
    "provenance_edges": [
      {
        "edge_id": "edge.operation.output",
        "from": { "kind": "compiler_operation", "node_id": "operation.add" },
        "to": { "kind": "compiler_output", "node_id": "output.0" },
        "producer": { "name": "coverage-tool", "version": "1", "executable_sha256": "0000000000000000000000000000000000000000000000000000000000000000", "arguments": [] }
      }
    ]
  },
  "reverse_reconciliation": {
    "compiler_outputs": [{ "record_id": "output.0", "operation_ids": ["operation.add"], "semantic_case_ids": ["case.add"], "model_effects": [{ "kind": "machine_step_effect", "effect_id": "effect.add", "guard_port_id": "p.effect.add", "enabled_port_id": "p.enabled", "next_state_port_id": "p.next", "image_instruction_ids": ["instruction.0"], "semantic_case_ids": ["case.add"], "observation_port_ids": ["p.obs"], "proof_obligation_id": "obligation.effect.add" }], "provenance_edge_ids": ["edge.operation.output"] }],
    "image_instructions": [{ "record_id": "instruction.0", "operation_ids": ["operation.add"], "semantic_case_ids": ["case.add"], "model_effects": [{ "kind": "machine_step_effect", "effect_id": "effect.add", "guard_port_id": "p.effect.add", "enabled_port_id": "p.enabled", "next_state_port_id": "p.next", "image_instruction_ids": ["instruction.0"], "semantic_case_ids": ["case.add"], "observation_port_ids": ["p.obs"], "proof_obligation_id": "obligation.effect.add" }], "provenance_edge_ids": ["edge.operation.output"] }],
    "semantic_cases": [
      {
        "semantic_case_id": "case.add",
        "origin": { "kind": "machine_instruction", "image_instruction_ids": ["instruction.0"] },
        "model_effects": [{ "kind": "machine_step_effect", "effect_id": "effect.add", "guard_port_id": "p.effect.add", "enabled_port_id": "p.enabled", "next_state_port_id": "p.next", "image_instruction_ids": ["instruction.0"], "semantic_case_ids": ["case.add"], "observation_port_ids": ["p.obs"], "proof_obligation_id": "obligation.effect.add" }],
        "semantics_artifact": { "artifact_id": "semantics.target", "artifact_type": "semantic_spec", "schema_version": 1, "sha256": "0000000000000000000000000000000000000000000000000000000000000000" },
        "provenance_edge_ids": ["edge.operation.output"]
      }
    ],
    "model_effects": [
      {
        "model_effect": { "kind": "machine_step_effect", "effect_id": "effect.add", "guard_port_id": "p.effect.add", "enabled_port_id": "p.enabled", "next_state_port_id": "p.next", "image_instruction_ids": ["instruction.0"], "semantic_case_ids": ["case.add"], "observation_port_ids": ["p.obs"], "proof_obligation_id": "obligation.effect.add" },
        "origin": { "kind": "machine_instruction", "image_instruction_ids": ["instruction.0"] },
        "operation_ids": ["operation.add"],
        "provenance_edge_ids": ["edge.operation.output"]
      }
    ]
  },
  "root_coverage": [
    {
      "root_id": "root.main",
      "root_kind": "program_root",
      "entry_coverage": {
        "kind": "circuit_predicate",
        "predicate_port_id": "p.root.main",
        "nonempty_proof": { "artifact_id": "proof.root.nonempty", "artifact_type": "proof_evidence", "schema_version": 1, "sha256": "0000000000000000000000000000000000000000000000000000000000000000" },
        "validated_exact_domain_certificate": { "artifact_id": "certificate.coverage", "artifact_type": "hyperray_validated_certificate", "schema_version": 2, "certificate_kind": "symbolic_coverage_equivalence", "sha256": "0000000000000000000000000000000000000000000000000000000000000000" }
      },
      "provenance": {
        "producer": { "name": "root-tool", "version": "1", "executable_sha256": "0000000000000000000000000000000000000000000000000000000000000000", "arguments": [] },
        "source_artifact": { "artifact_id": "roots", "artifact_type": "root_catalog", "schema_version": 1, "sha256": "0000000000000000000000000000000000000000000000000000000000000000" },
        "source_locator": "root.main"
      }
    }
  ],
  "query_root_selections": [
    {
      "query_id": "query.safety",
      "requirement_id": "requirement",
      "selected_root_ids": ["root.main"],